date,latitude,longitude,text,tweet_id
05/10/2019 14:50,38.8152,-82.1975,Yesterday was full of crafts new plants and lots of laughs with these wonderful ladies#firstfriday… ,1.18E+18
05/10/2019 14:50,33.45558265,-84.35738259,Snatching flags @ KempElementarySchool ,1.18E+18
05/10/2019 14:50,33.25333329,-97.20680742,Happy Birthday to this Awesome SKS Trainer! We you @guacaboley! #happybirthday #SKS #SilentKnightStables #We… ,1.18E+18
05/10/2019 14:50,39.10089963,-84.51370414,"Many thanks to @gatewayticket for inviting our VP Shawn McCoy to present ""The DNA of Memorable Attractions"" as th… ",1.18E+18
05/10/2019 14:50,36.1888352,-80.27590064,Starting fall off with Morticia’s Haunted Hot Chocolate @ IHOP ,1.18E+18
05/10/2019 14:50,26.01733,-81.69925,Super excited to show our newest listing today Barely lived in beautiful home 3BR plus den and bonus room Three… ,1.18E+18
05/10/2019 14:50,29.7602,-95.3694,Poppa Sauce drippin size 15 Dior worldwide Ooowwweee @SauceWalka102 @saucewalka102 @SplifdTv slimthug… ,1.18E+18
05/10/2019 14:50,33.28231437,-87.5966072,Just posted a photo @ Livingroom ,1.18E+18
05/10/2019 14:50,30.37921233,-86.86900975,Girls just wanna have fun! Goodbye Navarre you gave us an unforgettable week! @ Caribbean resort Navarre Beach ,1.18E+18
05/10/2019 14:50,35.8019142,-78.6875364,"Dont be shy Score a job like ""Business Office Manager"" at Morningside of Raleigh by asking for referrals Its a… ",1.18E+18
05/10/2019 14:50,19.30562746,-99.2102149,Any given Saturday morning adn40mx     #pop #photooftheday #picoftheday #dapper #suits #bespoke #tailored… ,1.18E+18
05/10/2019 14:50,38.9108408,-94.3821724,See our latest LeeS Summit MO EducationTraining job opportunity and click the link in our bio to apply Substitu… ,1.18E+18
05/10/2019 14:50,41.6062891,-93.7367254,Were hiring! Read about our latest job opening here Assistant Manager   #Hospitality #Clive IA,1.18E+18
05/10/2019 14:50,42.6064095,-83.1497751,This job might be a great fit for you Legal Assistant   #Legal #Troy MI,1.18E+18
05/10/2019 14:50,40.6535,-74.2606,I was freaking out but I finally trapped someone #xboxnation #xboxlive #epicgamesfortnite… ,1.18E+18
05/10/2019 14:50,40.763542,-74.304926,Were hiring! Click to apply Athletic TrainerACCMorahan Center   #Healthcare #Livingston NJ,1.18E+18
05/10/2019 14:50,32.4807435,-80.980386,If youre looking for work in Ridgeland SC check out this job  #SLPeeps #Pathologists,1.18E+18
05/10/2019 14:50,36.25086,-79.75639,Paige Dennis Kizzie and Possum are at Haw River State Park this morning for their Go Wild Family Fun Day!!! We c… ,1.18E+18
05/10/2019 14:50,34.7998,-84.0782,1450 KI4SVM Pat on W4GNG028 Parke Knob 1103m 8 pts 140650 CW RBNHole at W3UA 15 WPM 19 dB SNR RBNHOLE,1.18E+18
05/10/2019 14:50,29.903,-90.1429,It’s safe to say I made it through last nightspent that time wit my family #FOE ya heard me “I got family ties t… ,1.18E+18
05/10/2019 14:51,38.577,-121.4947,I trust in Him do you What holds you back from trusting God It’s taken me along while to accept that he ultimate… ,1.18E+18
05/10/2019 14:51,38.69559161,-75.07557185,Team Beers amp Cheers Too #Gaithersburg #NorthPotomac #Kentlands #Darnestown #beersandcheerstoo#finewine #craftbeer… ,1.18E+18
05/10/2019 14:51,38.7892801,-77.1872036,"Booz Allen Hamilton Inc is looking for teammates like you See our latest JCC ACCT GROUP job openings including ""… ",1.18E+18
05/10/2019 14:51,29.7281928,-98.0765337,"Dont submit then quit Apply for jobs like ""Restaurant Service and Kitchen Team 2532"" at Panda Express then loo… ",1.18E+18
05/10/2019 14:51,31.9685988,-99.9018131,"Join the GE team! See our latest #CustomerService job openings including ""Wind TechnicianRanchero"" via the link in our bio",1.18E+18
05/10/2019 14:51,43.6086194,-86.3639633,Want to work in #Shelby MI View our latest opening  #Accounting,1.18E+18
05/10/2019 14:51,29.7697858,-82.5312829,Join the Dollar General team! See our latest job opening here  #Alachua FL #FacilitiesMgmt,1.18E+18
05/10/2019 14:51,41.079273,-85.1393513,Can you recommend anyone for this job in #FortWayne IN  #SkilledTrade,1.18E+18
05/10/2019 14:51,36.1539816,-95.992775,"Nervous to apply for a job like ""Parttime Nabisco Retail Merchandise StockerTulsaOK"" at Mondelēz International… ",1.18E+18
05/10/2019 14:51,42.7653662,-71.467566,Robert Half Technology is hiring in #Nashua NH! Click the link in our bio to apply Product Support Specialist #IT,1.18E+18
05/10/2019 14:51,32.6106721,-96.75829412,Congresswoman @repebj and I @eifdotorg will see you from 10am1pm today! @BestSouthwest… ,1.18E+18
05/10/2019 14:51,33.046233,-96.994174,"Click the link in our bio to see currently open Contact CenterCustomer Support jobs like ""Care Coordinator"" at Kel… ",1.18E+18
05/10/2019 14:51,38.9458951,-84.680501,Want to work in #Union KY View our latest opening  #HealthWelfare,1.18E+18
05/10/2019 14:51,43.0895577,-79.0849436,This Client Care job might be a great fit for you Click the link in our bio to see it and more Registered Practic… ,1.18E+18
05/10/2019 14:51,46.25651413,-113.5221248,Have you ever had breakfast with a teenage moose Recruitment amp Training Manager Cat has and she highly recommends… ,1.18E+18
05/10/2019 14:51,43.76909062,-79.46870808,Stage Production Manager duties now loading again for the East meets West In D Six concert featuring headlining Int… ,1.18E+18
05/10/2019 14:51,41.883222,-87.632496,As seasons roll on by @davidgiambalvo ———————————————————————— Follow my #motivational journey through life!… ,1.18E+18
05/10/2019 14:51,37.7793,-122.419,Just a dancing on the beach kind of morning @ San Francisco California ,1.18E+18
05/10/2019 14:51,39.09784957,-94.58164393,Some scatting from the concert last night This is where you sing the improvisational notes you are playing at the… ,1.18E+18
05/10/2019 14:51,41.883222,-87.632496,As seasons roll on by @davidgiambalvo ———————————————————————— Follow my #motivational journey through life!… ,1.18E+18
05/10/2019 14:51,32.78100141,-97.27221316,Congratulations to Mr and Mrs Inmon on taking home their 2018 Forest River Rockwood 2304DS this past week! Sales… ,1.18E+18
05/10/2019 14:51,38.7209454,-75.0760137,"Sperry is looking for teammates like you See our latest #Retail job openings including ""Seasonal Temporary Store… ",1.18E+18
05/10/2019 14:51,35.9940329,-78.898619,"Dont be shy Score a job like ""Cybersecurity Technical Writer"" at Booz Allen Hamilton Inc by asking for referrals… ",1.18E+18
05/10/2019 14:51,36.3728538,-94.2088172,"Career tip for landing jobs like ""Service Agent  BentonvilleRogers"" in #Bentonville AR Go on informational inte… ",1.18E+18
05/10/2019 14:51,38.8799697,-77.1067698,Were hiring! Click to apply Vulnerability Management Program Lead   #BoozAllen #IT,1.18E+18
05/10/2019 14:51,36.730037,-102.49992,"Want to land a job like ""LEAD SALES ASSOCIATEFT in BOISE CITY OK"" at Dollar General Corporation Applicant tracki… ",1.18E+18
05/10/2019 14:51,34.07235857,-118.2598709,Dusk at the lake on a beautiful fall Friday with my two favorite people Brian amp TJ! @ Echo Park Lake ,1.18E+18
05/10/2019 14:51,36.6644676,-76.5950555,Remedy Intelligent Staffing is hiring in #Suffolk VA! Click the link in our bio to apply Quality Control #Manufacturing,1.18E+18
05/10/2019 14:51,39.1261803,-76.5906542,Looking to score a job at Ulta Beauty Youre in luck Click the link in our bio for the job description and inform… ,1.18E+18
05/10/2019 14:51,41.082303,-73.92315,Cleared Construction on #I87NYSThruway NB from After Exit 10 I87  South Nyack US 9W to Exit 11 I87  Nyack US 9W,1.18E+18
05/10/2019 14:51,41.082303,-73.92315,Cleared Construction on #I87NYSThruway NB from After Exit 10 I87  South Nyack US 9W to Exit 11 I87  Nyack US 9W,1.18E+18
05/10/2019 14:51,33.1972,-96.6397,So proud of this girl and all the things she has accomplished with her blog Shawna partnered with bravinginfertili… ,1.18E+18
05/10/2019 14:51,33.45789102,-111.6838977,Markets back mates! Here until 1 PM gt cmon by for your #cupofjoey fix and a little local shopping in the sunsh… ,1.18E+18
05/10/2019 14:51,33.73787,-118.28461,Good Morning Witches! Don’t forget our epic party coming up Oct 31 It’s BRB bring your own broom night Plus th… ,1.18E+18
05/10/2019 14:51,34.2436,-110.048,This bright sunlight is harshing my glow! But this cactus tree ring dish is still super stunning in Sonoran deser… ,1.18E+18
05/10/2019 14:51,41.51061208,-90.40845039,Im at BP in Silvis IL ,1.18E+18
05/10/2019 14:51,43.0880693,-77.6241298,Looking to score a job at Starbucks Youre in luck Click the link in our bio for the job description and informat… ,1.18E+18
05/10/2019 14:51,34.1073487,-84.0029303,"Click the link in our bio to see currently open #Healthcare jobs like ""Pharmacy Technician"" at CVS Health in #Buford GA",1.18E+18
05/10/2019 14:51,42.7773453,-71.4714928,Can you recommend anyone for this job in #Nashua NH  #Engineering,1.18E+18
05/10/2019 14:51,29.9229202,-90.0898666,Join us tonight 59 Sip and shop Support local small businesses and artist martysatdunnandsonnier heatherconkli… ,1.18E+18
05/10/2019 14:51,37.7577,-87.1184,Getting ready for the sunsetcruisers last cruise in here in @visitowensboro Come out and see me and owensborooffr… ,1.18E+18
05/10/2019 14:51,41.61776418,-90.7810491,Our view of the day #kryptonite #fladbedlife #diesellife #dsv #truckinglifestyle #goprohero5 #gopro #maxxmount… ,1.18E+18
05/10/2019 14:51,30.49696005,-97.61661889,For National Taco Day the #Market #GastroPub offered their three most popular tacos Bacon Egg amp Cheese Sausage… ,1.18E+18
05/10/2019 14:51,42.46097,-83.13054,Blueberry Lemon Poppyseed Scones made with Love by Chef Ashley Duncan at Otus Supplyserved with Michigan honey… ,1.18E+18
05/10/2019 14:51,40.0566139,-76.5544774,Wedding Bliss Natural updo @ Prettier Girls Beauty LLC  Prettier Girls Beauty Lounge Salon ,1.18E+18
05/10/2019 14:51,34.0522,-118.243,Batchelor X Baby Girl  #nowavailableonalloutlets  @ Los Angeles California ,1.18E+18
05/10/2019 14:51,40.00619873,-74.86395968,Im at Westampton Sports Complex in Westampton NJ ,1.18E+18
05/10/2019 14:51,40.7207559,-74.0007613,Its here! Part 2 Chicago Marathon 19 Race Week PopUps ,1.18E+18
05/10/2019 14:51,39.9525839,-75.1652215,Were hiring in #Philadelphia PA! Click the link in our bio to apply to this job and more Medical Billing Special… ,1.18E+18
05/10/2019 14:51,38.81975933,-76.88979598,It’s me hey hey @ Fast Eddies MD ,1.18E+18
05/10/2019 14:51,41.8186802,-72.479037,See our latest Vernon CT #lvn #nursinghome job opportunity and click the link in our bio to apply Licensed Practi… ,1.18E+18
05/10/2019 14:51,26.621043,-81.8333656,Can you recommend anyone for this job Account Specialist  Fire Protection  #cintasjobs #Service,1.18E+18
05/10/2019 14:51,37.31972222,-121.8683333,Focused! @ CEFCU Stadium ,1.18E+18
05/10/2019 14:51,35.3414744,-89.8973084,"Have you ever had a role like ""Management Trainee"" What did you like most about that job #Millington TN",1.18E+18
05/10/2019 14:51,40.99025,-85.03967,Nate Muri was the first one who visited Srilanka The second photo was taken in 2007 Thank you for Twelve years of… ,1.18E+18
05/10/2019 14:51,40.3014581,-79.5389289,Want to work in Greensburg PA View our latest opening  #WeHelpYouMakeIt #Sales,1.18E+18
05/10/2019 14:51,42.8897,-78.8306,Drinking a Solstice dEté Cerise by @BrasseriesDDC @ Shelton Brothers The Festival 2019 — ,1.18E+18
05/10/2019 14:51,36.12106951,-79.8348375,#GOALS @JustCallMeMav @marcussrealty1 wilkersonavery southerngentt1911 @ Jaycee Park ,1.18E+18
05/10/2019 14:51,41.0911335,-73.5621274,"Stop staring at the clock every day Its time for a new career Follow us to view jobs with titles like ""care mana… ",1.18E+18
05/10/2019 14:51,39.7426,-104.997,Drinking an Abby Blonde by @monkpub at @GABF — ,1.18E+18
05/10/2019 14:51,29.9022,-90.0294,How am I spending my free time for the rest of my life Reliving happy times playing old school video games!!! Sorr… ,1.18E+18
05/10/2019 14:51,39.7426,-104.997,Drinking a Screaming Monk by @monkpub at @GABF — ,1.18E+18
05/10/2019 14:51,44.9774,-93.2645,U can’t Tell Me Nuthin!!! @DNTUncontaineD Mr #FatBlackNuGly #WeOutHere @ Minneapolis Minnesota ,1.18E+18
05/10/2019 14:51,35.9509163,-83.9257126,Excited for this upcoming season Definitely feel like Lamonte Turner has stepped up and will be the leader on this… ,1.18E+18
05/10/2019 14:51,39.7426,-104.997,Drinking a Monkshake by @monkpub at @GABF — ,1.18E+18
05/10/2019 14:51,37.5483,-77.4408,Come check me out at one of Richmonds most #iconic events #2ndstreetfestival in #historic #jacksonward  The weat… ,1.18E+18
05/10/2019 14:51,38.59275,-90.52708,Get your tickets now!!!! Go to  for ticket sales! 2 shows available If you like the Muny or… ,1.18E+18
05/10/2019 14:51,32.7774,-96.7977,Ima just sit this… ,1.18E+18
05/10/2019 14:51,42.5311279,-88.5995456,"Have you ever had a role like ""PROJECT ASSISTANT"" What did you like most about that job #BusinessMgmt #Walworth WI",1.18E+18
05/10/2019 14:51,35.30437749,-82.79474681,Beyond that fog is miles and miles of mountains Thankfully I don’t hike just for the view at the top @ Looking… ,1.18E+18
05/10/2019 14:51,38.2575517,-76.4620928,See our latest Lexington Park MD job and click to apply Cloud Technical Trainee   #BoozAllen #IT,1.18E+18
05/10/2019 14:51,29.93559769,-90.078578,Saturday #sketchdump #visualdevelopement #sketching #sketchbook #illustration #drawing #design #art #pencilsketch @… ,1.18E+18
05/10/2019 14:51,40.9263957,-98.3420118,See our latest #GrandIsland NE #Healthcare job opportunity and click the link in our bio to apply Echo Technologi… ,1.18E+18
05/10/2019 14:51,40.6084305,-75.4901833,Want to work in #Allentown PA View our latest opening  #Engineering,1.18E+18
05/10/2019 14:51,38.86573,-83.90452,•SALE• Fall Wreaths 10 OFF! We only have these 3 left if you can’t make it up here we can send you an invoice t… ,1.18E+18
05/10/2019 14:51,40.7571187,-74.00182535,@nycomiccon Ready for the Saturday mayhem that is #newyorkcomiccon #newyorkcomiccon2019 #nycc #nycc2019… ,1.18E+18
05/10/2019 14:51,33.9562149,-83.9879625,"Want to land a job like ""Associate Vice President Global Operations  AUS"" at Aramark Applicant tracking systems… ",1.18E+18
05/10/2019 14:51,31.104619,-91.2995551,If youre looking for work in #Woodville MS check out this job  #CustomerService,1.18E+18
05/10/2019 14:51,38.8501078,-77.0391754,Want to work in #Arlington VA View our latest opening  #Government,1.18E+18
05/10/2019 14:51,33.4832005,-80.8703387,"Career tip for landing jobs like ""Retail Store Associate"" in #Orangeburg SC Go on informational interviews The b… ",1.18E+18
05/10/2019 14:51,33.691298,-112.316318,#wordsofwisdom #family @ Crossriver Sun City Arizona ,1.18E+18
05/10/2019 14:51,39.94834243,-75.15785735,#sightdayphl willseye @eagles @ Thomas Jefferson University ,1.18E+18
05/10/2019 14:51,28.13333333,-81.63166667,Cant get enough of this place florida ,1.18E+18
05/10/2019 14:51,38.42485,-78.85225,I loved this #trx #workoutroutine I put up today! Definitely going to be keeper! #personaltrainer #saturdayworkout… ,1.18E+18
05/10/2019 14:51,32.17677,-80.77173,Sunset last night @ Palmetto Bay Marina ,1.18E+18
05/10/2019 14:51,32.7155,-117.1585,Just posted a photo @ San Diego California ,1.18E+18
05/10/2019 14:51,26.7153424,-80.0533746,Robert Half Finance amp Accounting is hiring in #WestPalmBeach FL! Read about our latest #Accounting job opening via… ,1.18E+18
05/10/2019 14:51,40.8549809,-74.8319091,"Dont submit then quit Apply for jobs like ""Retail Store Associate"" at CVS Health then look for people you might… ",1.18E+18
05/10/2019 14:51,39.351049,-76.6962067,"Have you ever had a role like ""LEAD SALES ASSOCIATEPT in BALTIMORE MD"" What did you like most about that job… ",1.18E+18
05/10/2019 14:51,39.33,-83.06,Only thing I dont like about leaving for vacation hillbilly knows Im going He has been moping around Ill mi… ,1.18E+18
05/10/2019 14:51,37.803097,-81.1793429,This job is now open at Starbucks in #Beckley WV Follow us and turn on mobile alerts to hear about jobs like thes… ,1.18E+18
05/10/2019 14:51,41.19325225,-74.18380737,Im at Tuxedo NY in NY ,1.18E+18
05/10/2019 14:51,41.420034,-87.7417114,Can you recommend anyone for this job in #Monee IL  #Transportation,1.18E+18
05/10/2019 14:51,44.4669941,-73.1709604,"Career tip for landing jobs like ""Caregiver"" in #SouthBurlington VT Go on informational interviews The best way… ",1.18E+18
05/10/2019 14:51,39.6196709,-86.1650024,If youre looking for work in #Greenwood IN check out this job  #Nursing,1.18E+18
05/10/2019 14:51,40.7135097,-73.9859414,Want to work at RemX Were hiring in #NewYork NY! Click for details  #Media,1.18E+18
05/10/2019 14:51,40.7663711,-74.0253715,80 hotels and growing! Check out our latest opening for a Room Attendant in Weehawken NJ to join HEI Hotels wide… ,1.18E+18
05/10/2019 14:51,35.0455,-85.2673,Date night with John and Rachel last night Also that lady in the background and her friend surprised us by ra… ,1.18E+18
05/10/2019 14:51,32.9670028,-80.2009987,Want to work at CVS Health Were hiring in #Summerville SC! Click the link in our bio for details on this job and… ,1.18E+18
05/10/2019 14:51,36.7468422,-119.7725868,Want to work at OfficeTeam Were hiring in #Fresno CA! Click for details  #Marketing,1.18E+18
05/10/2019 14:51,39.9008,-74.8239,Daphne loves puffs #daphnemonroe #snacktime #gerberpuffs @ Medford New Jersey ,1.18E+18
05/10/2019 14:52,27.9634,-81.9494,Maybe a private sauna in your master suite is just the ticket Like it I previewed this home and it has lots of… ,1.18E+18
05/10/2019 14:52,43.20149557,-77.9206649,Long day of training ahead @ Lowes Home Improvement ,1.18E+18
05/10/2019 14:52,39.3384367,-84.30880976,Playing for my city! #daytonstrong @ Hope Church ,1.18E+18
05/10/2019 14:52,43.64749,-79.39539,@hellomtrinh went missing but I found him among the students! —Mum @learningcode #coderdog #datascientist… ,1.18E+18
05/10/2019 14:52,43.7166,-79.3407,Next week Friday October 11th is going to be with not 1 not 2 but 3 #African #Superstars performing #LIVE… ,1.18E+18
05/10/2019 14:52,32.2217429,-110.926479,"Have you ever had a role like ""2nd Shift Support Services Team Lead  Tucson AZ 85704"" What did you like most abo… ",1.18E+18
05/10/2019 14:52,38.9873427,-86.8621827,Were hiring in #Bloomfield IN! Click the link in our bio to apply to this job and more Contracts Principal at SAIC #BusinessMgmt,1.18E+18
05/10/2019 14:52,37.9322662,-87.8950267,"Click the link in our bio to see currently open #SupplyChain jobs like ""Logistics Coordinator"" at GAF in #MtVernon IN",1.18E+18
05/10/2019 14:52,43.34702793,-70.48339799,Saturday very late morning FYI its 52 degrees at the beach right now @ Goochs Beach ,1.18E+18
05/10/2019 14:52,42.8670039,-78.7068628,"Click the link in our bio to see currently open #Retail jobs like ""Shift Supervisor Management Trainee"" at CVS Health in #Depew NY",1.18E+18
05/10/2019 14:52,45.839855,-119.7005834,If youre looking for work in #Boardman OR check out this #Utilities job via the link in our bio Plant Equipment… ,1.18E+18
05/10/2019 14:52,38.8951,-77.0367,#washingtonmonument #uscapital #washingtondc #washingtonmetro @ Washington District of Columbia ,1.18E+18
05/10/2019 14:52,36.10248,-115.17149,What is Your Super Powers in Real Estate #eXpRealty is a amazing company and innovator in the real estate industr… ,1.18E+18
05/10/2019 14:52,39.9527,-75.1651,7 DAYS!!!! Were pulling up concoursedancebar for the only Party Bus for Womxn Who Love Womxn on the East Coast! J… ,1.18E+18
05/10/2019 14:52,33.4640149,-88.815725,New Flavor! To encourage fall to start we’ve released our Caramel Apple flavor! Come try it! @ The Pop Porium ,1.18E+18
05/10/2019 14:52,40.763186,-73.994508,#batzman @hellskitchennyc #fitnessphotographer #batzography planetfitness @bodybuildingcom #postworkout… ,1.18E+18
05/10/2019 14:52,19.4326077,-99.133208,ATampT is hiring in #MexicoCity DF! Click the link in our bio to apply Automation Manager,1.18E+18
05/10/2019 14:52,43.03873,-76.13919, of the day @ Syracuse DAV Volunteer Transportation Network ,1.18E+18
05/10/2019 14:52,48.4287,-123.3645,Got real fancy with this coffee table I’m building Had a blast figuring out how to make finger joints Turns out i… ,1.18E+18
05/10/2019 14:52,35.69648,-81.22436,Come take a picture with us!! #burtonfarmsgs @ Burton Farms General Store ,1.18E+18
05/10/2019 14:52,28.15530762,-82.69523905,Im at the Lakeview Church Tarpon spring today Come by andsayhi! #craftmarket #craftshow #lakeviewchurch… ,1.18E+18
05/10/2019 14:52,39.9611755,-82.9987942,This Logistics Transportation job might be a great fit for you Click the link in our bio to see it and more Mate… ,1.18E+18
05/10/2019 14:52,40.8570442,-74.0215285,"Click the link in our bio to see currently open #HR jobs like ""HR Specialist"" at OfficeTeam in #RidgefieldPark NJ",1.18E+18
05/10/2019 14:52,35.582301,-88.129068,If youre looking for work in #Decaturville TN check out this job  #Healthcare,1.18E+18
05/10/2019 14:52,41.3838782,-72.9026064,Robert Half Finance amp Accounting is hiring in #Hamden CT! Read about our latest #Accounting job opening via the li… ,1.18E+18
05/10/2019 14:52,41.6793503,-81.3049392,Want to work at Boston Market Were hiring in Mentor OH! Click the link in our bio for details on this job and mo… ,1.18E+18
05/10/2019 14:52,35.2044886,-89.7865062,"Lowes is looking for teammates like you See our latest #SupplyChain job openings including ""ReceiverStocker  … ",1.18E+18
05/10/2019 14:52,42.87472222,-98.70027778,Seven miles‍ on the prettiest fall morninguntil the wind got wicked crazy amp I started getting pelted by lea… ,1.18E+18
05/10/2019 14:52,25.88639407,-80.32364256,Omw 2 the Rock ,1.18E+18
05/10/2019 14:52,37.5373,-77.4371,Finally got to see Downton Abbey a few days ago on a night out with the girlfriends Then we walked across the stre… ,1.18E+18
05/10/2019 14:52,34.17694,-118.31777,Legacy NoGi #LegacyBJJ #NoGi #OneTeamOneGoal @sdotb @ Legacy Los Angeles ,1.18E+18
05/10/2019 14:52,36.56032506,-87.25651367,Coming Home with the Hawks! #AlumniWeekend Huge Thank You to all of our parents and players for making this event… ,1.18E+18
05/10/2019 14:52,40.7549309,-73.9840195,Yesterday was a blast Got to venture around Manhattan all day with @bdebartoli So much walking my legs are shot t… ,1.18E+18
05/10/2019 14:52,39.9624,-82.9996,art is easy the constant baring of your soul to the outside world only to receive endless criticism about your vis… ,1.18E+18
05/10/2019 14:52,33.9306304,-81.38720004,Our pumpkin spice patina is on special today Open until at least 3 in feeling Fallish #gilbertamerica #Antiques… ,1.18E+18
05/10/2019 14:52,33.5119736,-82.2193009,Looking to score a job at Dollar General Corporation Youre in luck Click the link in our bio for the job descrip… ,1.18E+18
05/10/2019 14:52,39.28245,-76.60228384,Yes I was a pirate for a day in the Baltimore harborwith champagne of course #baltimore #pirate… ,1.18E+18
05/10/2019 14:52,41.9994722,-88.1450735,As part of our global team at Thermo Fisher Scientific what you do contributes directly to our mission enabling o… ,1.18E+18
05/10/2019 14:52,40.224152,-74.094329,"Nervous to apply for a job like ""Support Associate"" at White House Black Market Apply even if youre not a 100 ma… ",1.18E+18
05/10/2019 14:52,42.5350462,-70.8864553,"Dont submit then quit Apply for jobs like ""Bartenders"" at 99 Restaurants then look for people you might know at… ",1.18E+18
05/10/2019 14:52,42.1726224,-72.6417541,Were hiring in Holyoke MA! Click the link in our bio to apply to this job and more Sales amp Inventory Manager at… ,1.18E+18
05/10/2019 14:52,30.3321838,-81.655651,This job is now open at ABRA Caliber Collision in #Jacksonville FL Follow us and turn on mobile alerts to hear ab… ,1.18E+18
05/10/2019 14:52,29.7604267,-95.3698028,This job is now open at Baylor College of Medicine in #Houston TX Follow us and turn on mobile alerts to hear abo… ,1.18E+18
05/10/2019 14:52,40.1533171,-82.90304976,What a game as it was rough sledding for both QB’s as defense along with neon was the theme of the night! I have a… ,1.18E+18
05/10/2019 14:52,40.71058,-73.9264,#Repost @TheBKMirage getrepost NYE 2020 Lineup A 27hour metamorphic Odyssey More headliners to be reveale… ,1.18E+18
05/10/2019 14:52,40.81400477,-74.21882257,Im at Bow Tie Clairidge Cinema for Rosemarys Baby in Montclair NJ ,1.18E+18
05/10/2019 14:52,34.00055556,-81.04416667,Cooking and serving lunch to these fine folks today! Thank you @columbiapdsc for keeping @CityofColumbia safe! … ,1.18E+18
05/10/2019 14:52,35.78617322,-78.75458188,Boys are off! #GAXC @ WakeMed Soccer Park ,1.18E+18
05/10/2019 14:52,39.49507744,-74.46000206,Stop by the Smithville Ocktoberfest and take the challenge Check out our stories today to see more    #marines… ,1.18E+18
05/10/2019 14:52,44.85374573,-93.24065696,9 videos shot edited and projected in the rotunda within 24 hours! Couldn’t have done it without my main girl rl… ,1.18E+18
05/10/2019 14:52,45.1258332,-94.5283333,Wells Fargo is hiring in #Litchfield MN! Read about our latest #Banking job opening via the link in our bio Teller 20 Hours,1.18E+18
05/10/2019 14:52,46.8787176,-113.996586,Want to work at US Bank Were hiring in #Missoula MT! Click for details  #Finance,1.18E+18
05/10/2019 14:52,39.2713976,-76.5603828,Want to work in Baltimore MD View our latest opening LINK CUSTOM HASHTAGS  #cintasjobs #Sales,1.18E+18
